{
  "id": "IF-06/first-true-wins",
  "criteria": [
    "IF-06"
  ],
  "tags": [
    "core"
  ],
  "script": {
    "decide": [
      {
        "answers": [
          {
            "kind": "yesno",
            "probability": 0.05
          },
          {
            "kind": "yesno",
            "probability": 0.95
          },
          {
            "kind": "yesno",
            "probability": 0.9
          }
        ]
      }
    ]
  },
  "calls": [
    {
      "group": 0,
      "op": "if",
      "state": "x",
      "handlers": [
        "then",
        "elseif",
        "else"
      ],
      "conditions": [
        {
          "condition": "A"
        },
        {
          "condition": "B"
        },
        {
          "condition": "C"
        }
      ]
    }
  ],
  "expect": {
    "results": [
      {
        "branch": "elseif",
        "index": 1,
        "condition": "B",
        "probability": 0.95,
        "probabilities": [
          0.05,
          0.95,
          0.9
        ],
        "unsureIndexes": []
      }
    ],
    "handlersRun": [
      [
        "elseif"
      ]
    ],
    "errors": [
      null
    ],
    "backendCalls": 1
  }
}
